{"authorityClass":"final-product","conformancePlan":{"canonicalSha256":"2cf7b481946ce1c0130e70b0d0ffcc1ec5a58bb10e7963b3f5058253bb63447a","observationScope":"adapter-invocation-trace","path":"contracts/ordered-map/conformance-plan.json","rawSha256":"bfffbe98114c78c04865bccadc143a02cd46beff71c0f04c0b7f5b522d15c1d3"},"deploymentBoundary":{"direct":false,"direction":"consumer-to-realization","interfaceMechanism":"NDJSON messages over stdin and stdout","mechanism":"child-process-ndjson"},"finalProductAuthority":true,"formatVersion":1,"id":"ordered-map-product-contract","manifest":{"path":"registry/ordered-map/manifest.json","rawSha256":"0dae972b40c850f691df0856577cf8a9d66449a4655dcbb0c328b20c6993455d"},"profile":{"address":{"id":"ordered-map-ascii-fold","kind":"realizationProfile","version":"0.1.0"},"rawSha256":"6d1297892c355a569e244c2b94448a5f5edaf9b1bf2ae54f940d7c4494fe225f"},"resolver":{"acceptedCampaignMechanism":"bounded-conformance-campaign","assurance":"per-declaration-one-accepted-applicable-support-no-selected-challenge","concernCategories":[{"concern":"law.conformance","declarationField":"laws"},{"concern":"resource.persistence","declarationField":"resources"},{"concern":"effect.conformance","declarationField":"effects"},{"concern":"performance","declarationField":"performancePropositions"}],"effectScope":"adapter-invocation-trace"},"sources":[{"roles":["theory-authored","dependency"],"selector":"ordered-map-theory"},{"roles":["package-authored"],"selector":"ordered-map-rust"},{"roles":["package-authored"],"selector":"ordered-map-typescript"},{"roles":["package-consumer-authored"],"selector":"ordered-map-consumer"}],"specification":{"address":{"id":"ordered-map","kind":"specification","version":"0.1.0"},"rawSha256":"6049d371603cbdac0e722685f1fd25c7369872f7d963ae2e4f4bae90cce7fd7f"},"version":"0.1.0"}
